id,issues,query
q10726,bad_rationales_count,Explain how digital pathology can aid in the detection of equine sarcoid.
q10727,bad_rationales_count,Describe the diagnostic value of digital pathology in identifying canine lymphoma.
q10728,bad_rationales_count,Discuss the role of digital pathology in diagnosing feline cutaneous mast cell tumors.
q10729,bad_rationales_count,Explain how digital pathology can aid in the detection of equine melanoma.
q10730,bad_rationales_count,Describe the diagnostic utility of digital pathology in identifying canine transmissible venereal tumor.
q10731,bad_rationales_count,Discuss the role of digital pathology in diagnosing feline mammary carcinoma.
q10732,bad_rationales_count,Explain how digital pathology can aid in the detection of equine granuloma.
q10753,bad_rationales_count,Describe the clinical presentation and diagnostic approach for acute respiratory distress syndrome (ARDS) in a critically ill patient.
q10754,bad_rationales_count,What are the common causes and risk factors for ARDS in a critically ill patient?
q10755,bad_rationales_count,What are the management strategies for ARDS in a critically ill patient?
q10756,bad_rationales_count,Describe the pathophysiology of ARDS in a critically ill patient.
q10757,bad_rationales_count,What are the prognostic factors for ARDS in a critically ill patient?
q10758,bad_rationales_count,What are the differences between ARDS and acute lung injury (ALI)?
q10759,bad_rationales_count,What are the treatment options for refractory hypoxemia in ARDS?
q10760,bad_rationales_count,What is the role of corticosteroids in the management of ARDS?
q10761,bad_rationales_count,What is the impact of ARDS on long-term outcomes for critically ill patients?
q10762,bad_rationales_count,What is the role of non-invasive ventilation (NIV) in the management of ARDS?
q10763,bad_rationales_count,What are the differences between ARDS and cardiogenic pulmonary edema?
q10764,bad_rationales_count,What are the diagnostic criteria for ARDS according to the Berlin Definition?
q10765,bad_rationales_count,What are the potential complications of mechanical ventilation in ARDS?
q10766,bad_rationales_count,What are the differences between ARDS and pulmonary edema due to sepsis?
q10767,bad_rationales_count,What are the differences between ARDS and aspiration pneumonia?
q10768,bad_rationales_count,What are the differences between ARDS and acute eosinophilic pneumonia?
q10769,bad_rationales_count,What are the differences between ARDS and hypersensitivity pneumonitis?
q10770,bad_rationales_count,What are the differences between ARDS and interstitial lung disease?
q10771,bad_rationales_count,What are the differences between ARDS and acute interstitial pneumonia?
q10790,bad_rationales_count,Describe the clinical presentation and diagnostic tests for Cushing's syndrome in dogs.
q10791,bad_rationales_count,What are the common causes of hypoglycemia in cats and how can it be diagnosed?
q10792,bad_rationales_count,What are the long-term complications of diabetes mellitus in dogs?
q10793,bad_rationales_count,What are the risk factors for developing type 2 diabetes in humans?
q10794,bad_rationales_count,What are the treatment options for primary aldosteronism in humans?
q10795,bad_rationales_count,What are the symptoms of Addison's disease in dogs?
q10796,bad_rationales_count,What are the diagnostic tests for hypothyroidism in cats?
q10797,bad_rationales_count,What are the long-term complications of untreated hypothyroidism in humans?
q10798,bad_rationales_count,What are the treatment options for hypothyroidism in dogs?
q10799,bad_rationales_count,What are the risk factors for developing hypothyroidism in humans?
q10800,bad_rationales_count,What are the symptoms of hyperthyroidism in cats?
q10801,bad_rationales_count,What are the diagnostic tests for hyperthyroidism in dogs?
q10802,bad_rationales_count,What are the long-term complications of untreated hyperthyroidism in humans?
q10803,bad_rationales_count,What are the treatment options for hyperthyroidism in humans?
q10804,bad_rationales_count,Describe the clinical presentation of a patient with advanced HIV-associated tuberculosis.
q10805,bad_rationales_count,What are the common diagnostic tests for HIV infection in a resource-limited setting?
q10806,bad_rationales_count,Discuss the role of antiretroviral therapy (ART) in preventing mother-to-child transmission of HIV.
q10808,bad_rationales_count,What are the common clinical features of Kaposi's sarcoma in HIV patients?
q10809,bad_rationales_count,Discuss the role of antiretroviral therapy (ART) in improving survival outcomes for HIV patients.
q10810,bad_rationales_count,What are the common laboratory findings in a patient with HIV-associated cryptococcal meningitis?
q10811,bad_rationales_count,Describe the clinical presentation of a patient with HIV-associated cryptococcal meningitis.
q10812,bad_rationales_count,What are the common diagnostic tests for cryptococcal meningitis in a resource-limited setting?
q10813,bad_rationales_count,Discuss the role of antifungal therapy in treating HIV-associated cryptococcal meningitis.
q10814,bad_rationales_count,Describe the common clinical presentation of essential thrombocythemia in a middle-aged human patient.
q10815,bad_rationales_count,What are the diagnostic criteria for myelodysplastic syndromes in a geriatric human patient?
q10816,bad_rationales_count,Discuss the role of JAK2 V617F mutation in the pathogenesis of polycythemia vera.
q10817,bad_rationales_count,Describe the typical imaging findings in a patient with splenomegaly due to myelofibrosis.
q10818,bad_rationales_count,What are the potential complications of long-term treatment with hydroxyurea in a patient with polycythemia vera?
q10819,bad_rationales_count,Discuss the role of interferon alpha in the management of myelodysplastic syndromes.
q10820,bad_rationales_count,What are the diagnostic criteria for idiopathic thrombocytopenic purpura (ITP) in a pediatric patient?
q10821,bad_rationales_count,Describe the typical laboratory findings in a patient with myelofibrosis.
q10822,bad_rationales_count,What are the potential complications of splenectomy in a patient with myelofibrosis?
q10823,bad_rationales_count,Discuss the role of ruxolitinib in the treatment of myelofibrosis.
q10824,bad_rationales_count,What are the diagnostic criteria for chronic myeloid leukemia (CML) in a young adult?
q10825,name_like,Describe the diagnostic approach for a patient with suspected colorectal cancer in Medical Oncology.
q10826,name_like,What are the common risk factors associated with breast cancer in Medical Oncology?
q10827,name_like,Discuss the treatment options for advanced stage lung adenocarcinoma in Medical Oncology.
q10828,name_like,Describe the role of surgery in managing ovarian cancer in Medical Oncology.
q10829,name_like,What are the common symptoms of prostate cancer in Medical Oncology?
q10830,name_like,Discuss the role of radiation therapy in treating brain metastases in Medical Oncology.
q10831,name_like,Describe the diagnostic process for a patient with suspected pancreatic cancer in Medical Oncology.
q10832,name_like,What are the common side effects of chemotherapy in Medical Oncology?
q10833,name_like,Discuss the role of immunotherapy in treating melanoma in Medical Oncology.
q10834,name_like,Describe the diagnostic process for a patient with suspected liver cancer in Medical Oncology.
q10835,bad_rationales_count,Describe the role of radiation therapy in treating brain metastases in dogs.
q10836,bad_rationales_count,What are the common side effects of radiation therapy for prostate cancer in cats?
q10846,bad_rationales_count,Describe the clinical presentation and diagnostic approach for systemic lupus erythematosus (SLE) in a pediatric patient.
q10847,bad_rationales_count,What are the potential complications and management strategies for a patient with acute gouty arthritis?
q10848,bad_rationales_count,Describe the pathophysiology of antiphospholipid syndrome (APS) and its association with thromboembolic events.
q10849,bad_rationales_count,What are the diagnostic criteria for Sjogren's syndrome and how does it differ from primary Sjogren's syndrome and secondary Sjogren's syndrome?
q10850,bad_rationales_count,Describe the role of antimalarial drugs in the treatment of lupus nephritis.
q10851,bad_rationales_count,What are the diagnostic criteria for rheumatoid arthritis (RA) and how does it differ from psoriatic arthritis?
q10852,bad_rationales_count,Describe the role of biologic disease-modifying antirheumatic drugs (bDMARDs) in the treatment of rheumatoid arthritis.
q10853,bad_rationales_count,What are the diagnostic criteria for ankylosing spondylitis (AS) and how does it differ from reactive arthritis?
q10854,bad_rationales_count,Describe the role of nonsteroidal anti-inflammatory drugs (NSAIDs) in the management of ankylosing spondylitis.
q10865,bad_rationales_count,Describe common clinical presentations of delirium in elderly patients.
q10866,bad_rationales_count,What are the risk factors for pressure ulcers in elderly patients?
q10867,bad_rationales_count,What diagnostic tests are useful for diagnosing urinary tract infections (UTIs) in elderly patients?
q10869,bad_rationales_count,What are the common complications associated with hip fractures in elderly patients?
q10870,bad_rationales_count,What are the diagnostic criteria for dementia in elderly patients?
q10872,bad_rationales_count,What are the common causes of syncope (fainting) in elderly patients?
q10873,bad_rationales_count,What are the diagnostic tests for congestive heart failure in elderly patients?
q10875,bad_rationales_count,What are the common complications associated with diabetes in elderly patients?
q10876,name_like,What are the diagnostic criteria for Alzheimer's disease in elderly patients?
q10878,bad_rationales_count,Describe common clinical signs and laboratory findings in a neonate with congenital heart disease.
q10879,bad_rationales_count,What are the key differences between neonatal sepsis and bacteremia?
q10880,bad_rationales_count,What are the common causes and risk factors for neonatal jaundice?
q10881,bad_rationales_count,What are the diagnostic imaging techniques used for a suspected case of neonatal hip dysplasia?
q10882,bad_rationales_count,What are the treatment options for a neonate with congenital adrenal hyperplasia?
q10883,bad_rationales_count,What are the common symptoms and complications associated with neonatal meningitis?
q10884,bad_rationales_count,What are the diagnostic criteria for neonatal tetanus?
q10885,bad_rationales_count,What are the common causes and risk factors for neonatal seizures?
q10886,bad_rationales_count,What are the treatment options for a neonate with congenital diaphragmatic hernia?
q10887,bad_rationales_count,What are the common symptoms and complications associated with neonatal pneumonia?
q10888,bad_rationales_count,What are the diagnostic criteria for neonatal hypoglycemia?
q10889,bad_rationales_count,What are the common causes and risk factors for neonatal jaundice in premature infants?
q10890,bad_rationales_count,What are the treatment options for a neonate with congenital hypothyroidism?
q10913,name_like,What are the indications for implantable cardioverter-defibrillator (ICD) placement in a 72-year-old female with a history of heart failure and ventricular tachycardia?
q10916,name_like,What are the indications for transcatheter aortic valve replacement (TAVR) in a 78-year-old female with severe aortic stenosis and a history of multiple comorbidities?
q10983,name_like,What are the risk factors associated with canine narcolepsy?
q10985,bad_rationales_count,Describe the typical clinical presentation of a patient with epilepsy.
q10986,bad_rationales_count,What are common diagnostic tests for epilepsy?
q10987,bad_rationales_count,What are the treatment options for a patient with refractory epilepsy?
q10988,bad_rationales_count,What are the risk factors for developing epilepsy?
q10989,bad_rationales_count,What is the prognosis for a patient with epilepsy?
q10990,bad_rationales_count,What is the difference between epilepsy and seizures?
q10991,bad_rationales_count,What are the common causes of status epilepticus?
q10992,bad_rationales_count,What is the role of EEG in diagnosing and managing status epilepticus?
q10993,bad_rationales_count,What are the potential complications of status epilepticus?
q10994,bad_rationales_count,What is the difference between non-convulsive status epilepticus and other forms of altered consciousness?
q10995,bad_rationales_count,What are the treatment options for non-convulsive status epilepticus?
q10996,bad_rationales_count,What are the risk factors for developing non-convulsive status epilepticus?
q10997,bad_rationales_count,What is the prognosis for patients with non-convulsive status epilepticus?
q11100,name_like,What are the key differences between Parkinson's disease and Multiple System Atrophy (MSA) in terms of clinical presentation?
q11101,name_like,What are the common imaging findings in a patient with Multiple Sclerosis (MS)?
q11102,name_like,What are the key risk factors for developing Multiple Sclerosis (MS)?
q11103,name_like,What are the common speech and language impairments in a patient with Multiple Sclerosis (MS)?
q11104,name_like,What are the common occupational therapy interventions for a patient with Multiple Sclerosis (MS)?
q11105,name_like,What are the common physical therapy interventions for a patient with Multiple Sclerosis (MS)?
q11109,bad_rationales_count,Discuss the role of diet in managing hyperkalemia in a patient with chronic kidney disease.
q11110,bad_rationales_count,Describe the nutritional requirements for a post-operative dog recovering from a gastrointestinal surgery.
q11111,bad_rationales_count,Discuss the importance of maintaining adequate hydration in a patient with diabetes insipidus.
q11112,bad_rationales_count,Describe the nutritional implications of a liver transplant in a patient with cirrhosis.
q11113,bad_rationales_count,Discuss the role of diet in managing hyperlipidemia in a patient with heart disease.
q11114,bad_rationales_count,Describe the nutritional considerations for a patient with malabsorption syndrome.
q11115,bad_rationales_count,Discuss the role of diet in managing hypoglycemia in a patient with diabetes mellitus.
q11116,bad_rationales_count,Describe the nutritional requirements for a premature infant.
q11117,bad_rationales_count,Discuss the role of diet in managing hyperuricemia in a patient with gout.
q11118,bad_rationales_count,Describe the nutritional considerations for a patient with anorexia nervosa.
q11119,bad_rationales_count,Discuss the role of diet in managing hypercalcemia in a patient with hyperparathyroidism.
q11120,bad_rationales_count,Describe the nutritional requirements for a patient with cystic fibrosis.
q11121,bad_rationales_count,Discuss the role of diet in managing hypoglycemia in a patient with insulinoma.
q11122,bad_rationales_count,Describe the nutritional considerations for a patient with celiac disease.
q11123,bad_rationales_count,Discuss the role of diet in managing hypernatremia in a patient with diabetes insipidus.
q11124,bad_rationales_count,Describe the nutritional requirements for a patient with Crohn's disease.
q11125,bad_rationales_count,Discuss the role of diet in managing hypokalemia in a patient with diuretic therapy.
q11126,bad_rationales_count,Describe the nutritional considerations for a patient with pancreatitis.
q11135,bad_rationales_count,Describe the role of a clinical research coordinator in managing patient enrollment for a clinical trial.
q11136,bad_rationales_count,What are the key steps involved in the process of obtaining informed consent from a participant in a clinical trial?
q11137,bad_rationales_count,Explain the importance of randomization and blinding in clinical trials.
q11138,bad_rationales_count,What is the purpose of a data monitoring committee (DMC) in a clinical trial?
q11139,bad_rationales_count,Describe the process of interim analysis in a clinical trial.
q11140,bad_rationales_count,What is the role of statistical analysis in evaluating the results of a clinical trial?
q11141,bad_rationales_count,Explain the concept of placebo-controlled trials and their importance in clinical research.
q11142,bad_rationales_count,What is the purpose of a phase I clinical trial?
q11143,bad_rationales_count,Describe the differences between single-arm and parallel-group designs in clinical trials.
q11144,bad_rationales_count,What is the purpose of a phase II clinical trial?
q11145,bad_rationales_count,Explain the concept of crossover trials and their advantages and disadvantages.
q11146,bad_rationales_count,What is the purpose of a phase III clinical trial?
q11147,bad_rationales_count,Describe the process of post-market surveillance and its importance in ensuring drug safety.
q11148,bad_rationales_count,What is the role of pharmacogenomics in personalized medicine?
q11149,bad_rationales_count,Explain the concept of adaptive clinical trials and their potential benefits.
q11177,bad_rationales_count,Describe the role of a hospital administrator in managing patient flow during a pandemic.
q11178,bad_rationales_count,Discuss the impact of hospital readmission rates on healthcare administration and financial management.
q11179,bad_rationales_count,Explain the importance of effective communication in hospital management.
q11180,bad_rationales_count,Describe the role of hospital administrators in managing budgets and financial resources.
q11181,bad_rationales_count,Discuss the role of hospital administrators in ensuring patient safety and quality of care.
q11182,bad_rationales_count,Explain the importance of data analysis in hospital management.
q11183,bad_rationales_count,Discuss the role of hospital administrators in managing staff and human resources.
q11184,bad_rationales_count,Explain the role of hospital administrators in managing information technology and electronic health records.
q11185,bad_rationales_count,Discuss the role of hospital administrators in managing emergency preparedness and disaster response.
q11186,bad_rationales_count,Explain the role of hospital administrators in managing patient satisfaction and customer service.
q11187,bad_rationales_count,Discuss the role of hospital administrators in managing quality improvement initiatives.
q11188,bad_rationales_count,Explain the role of hospital administrators in managing research and innovation.
q11189,name_like,Discuss the role of a Clinical Ethics Committee in ensuring informed consent for a minor's medical treatment.
q11190,name_like,Describe a scenario where a Clinical Ethics Committee might be involved in end-of-life care decisions for an elderly patient.
q11191,name_like,Explain how a Clinical Ethics Committee might address conflicts of interest in research involving human subjects.
q11192,name_like,Discuss the role of a Clinical Ethics Committee in addressing issues related to organ donation and transplantation.
q11193,name_like,Describe a scenario where a Clinical Ethics Committee might be involved in addressing conflicts between medical staff and patients or families.
q11194,name_like,Explain how a Clinical Ethics Committee might address issues related to confidentiality and privacy in healthcare.
q11195,name_like,Discuss the role of a Clinical Ethics Committee in addressing issues related to research involving vulnerable populations.
q11196,name_like,Describe a scenario where a Clinical Ethics Committee might be involved in addressing issues related to advance care planning.
q11197,name_like,Explain how a Clinical Ethics Committee might address issues related to resource allocation in healthcare.
q11198,name_like,Describe a scenario where a Clinical Ethics Committee might be involved in addressing issues related to cultural and religious beliefs in healthcare.
q11199,name_like,Discuss the role of a Clinical Ethics Committee in addressing issues related to clinical trials and research misconduct.
q11200,name_like,Describe a scenario where a Clinical Ethics Committee might be involved in addressing issues related to medical errors and adverse events.
q11201,name_like,Explain how a Clinical Ethics Committee might address issues related to patient autonomy and decision-making capacity.
q11202,name_like,Describe a scenario where a Clinical Ethics Committee might be involved in addressing issues related to end-of-life decisions for terminally ill animals.
q11203,name_like,Explain how a Clinical Ethics Committee might address issues related to research involving animals.
q11204,name_like,Describe a scenario where a Clinical Ethics Committee might be involved in addressing issues related to informed consent for animal owners.
q11205,name_like,Explain how a Clinical Ethics Committee might address issues related to resource allocation in veterinary medicine.
q11206,name_like,Describe a scenario where a Clinical Ethics Committee might be involved in addressing issues related to cultural and religious beliefs in veterinary medicine.
q11207,bad_rationales_count,Describe the diagnostic approach for a patient presenting with chest pain and shortness of breath.
q11208,bad_rationales_count,What are the key considerations when managing a patient with diabetes who presents with ketoacidosis?
q11209,bad_rationales_count,Discuss the role of telemedicine in mental health care for elderly patients.
q11210,bad_rationales_count,What are the potential risks associated with long-term use of nonsteroidal anti-inflammatory drugs (NSAIDs)?
q11211,bad_rationales_count,Explain the diagnostic process for a patient presenting with unexplained weight loss and fatigue.
q11212,bad_rationales_count,Discuss the role of telemedicine in managing chronic diseases such as asthma.
q11213,bad_rationales_count,What are the key differences between acute and chronic kidney disease?
q11214,bad_rationales_count,Describe the role of telemedicine in managing patients with chronic obstructive pulmonary disease (COPD).
q11215,bad_rationales_count,What are the potential complications associated with long-term use of corticosteroids?
q11216,bad_rationales_count,Explain the diagnostic process for a patient presenting with persistent headaches and visual disturbances.
q11217,bad_rationales_count,Discuss the role of telemedicine in managing patients with congestive heart failure.
q11218,bad_rationales_count,What are the key differences between type 1 and type 2 diabetes?
q11219,bad_rationales_count,Describe the role of telemedicine in managing patients with chronic pain.
q11220,bad_rationales_count,What are the potential complications associated with long-term use of anticoagulants?
q11221,bad_rationales_count,Explain the diagnostic process for a patient presenting with unexplained fever and rash.
q11222,bad_rationales_count,Discuss the role of telemedicine in managing patients with sleep apnea.
q11223,bad_rationales_count,What are the key differences between acute and chronic liver disease?
q11224,bad_rationales_count,Describe the role of telemedicine in managing patients with chronic obstructive pulmonary disease (COPD) exacerbations.
q11266,name_like,Describe the clinical presentation and diagnostic approach for a patient with suspected West Nile virus infection.
q11270,name_like,Discuss the role of next-generation sequencing in identifying genetic mutations associated with inherited retinal diseases.
q11272,name_like,Discuss the application of liquid biopsy in monitoring minimal residual disease in leukemia patients.
q11285,name_like,Explain the role of epigenetics in understanding the development and treatment of autoimmune diseases.
q11352,bad_rationales_count,Describe the role of hyaluronic acid in dermal fillers used for cosmetic purposes.
q11353,bad_rationales_count,What are the common side effects of Botox injections for cosmetic purposes?
q11354,bad_rationales_count,How does laser resurfacing work in cosmetic dermatology?
q11355,bad_rationales_count,What are the risks associated with chemical peels in cosmetic dermatology?
q11356,bad_rationales_count,How does microdermabrasion improve the appearance of the skin?
q11357,bad_rationales_count,What are the advantages of using platelet-rich plasma (PRP) in cosmetic dermatology?
q11358,bad_rationales_count,What are the potential complications of lip augmentation procedures?
q11359,bad_rationales_count,How does the use of dermal rollers work in cosmetic dermatology?
q11360,bad_rationales_count,What are the advantages of using radiofrequency (RF) in cosmetic dermatology?
q11361,bad_rationales_count,What are the potential risks associated with non-invasive fat reduction procedures?
q11362,bad_rationales_count,How does the use of chemical peels work in cosmetic dermatology?
q11363,bad_rationales_count,What are the benefits of using microneedling in cosmetic dermatology?
q11364,bad_rationales_count,Describe the indications for hyperbaric oxygen therapy in carbon monoxide poisoning.
q11365,bad_rationales_count,What are the benefits of hyperbaric oxygen therapy in decompression sickness?
q11366,bad_rationales_count,Discuss the role of hyperbaric oxygen therapy in treating diabetic foot ulcers.
q11367,bad_rationales_count,Explain the mechanism of action of hyperbaric oxygen therapy in improving ischemic stroke outcomes.
q11368,bad_rationales_count,Describe the role of hyperbaric oxygen therapy in managing gas gangrene.
q11369,bad_rationales_count,What are the potential complications of hyperbaric oxygen therapy in treating necrotizing fasciitis?
q11370,bad_rationales_count,Discuss the role of hyperbaric oxygen therapy in managing carbon monoxide poisoning in animals.
q11371,bad_rationales_count,What are the indications for hyperbaric oxygen therapy in treating gas gangrene in animals?
