id,issues,query
q0001,bad_rationales_count,How do proteins contribute to cellular function?
q0002,bad_rationales_count,What are the roles of RNA in genetic expression?
q0003,bad_rationales_count,What are the functions of DNA repair mechanisms?
q0004,bad_rationales_count,How does gene expression regulation occur?
q0005,bad_rationales_count,What are the consequences of genetic mutations?
q0028,name_like,What laboratory tests are essential in the diagnosis of heavy metal poisoning?
q0081,name_like,What historical events or figures have significantly impacted the development of medical ethics in the field of Medical Humanities?
q0082,name_like,What are some key ethical considerations when discussing end-of-life care decisions with patients suffering from terminal illnesses in Medical Humanities?
q0083,name_like,"How has the history of medical ethics evolved in response to advancements in technology, such as genetic engineering and artificial intelligence, within Medical Humanities?"
q0146,name_like,"What are the diagnostic criteria and treatment options for a patient with heart failure, peripheral edema, and shortness of breath?"
q0334,name_like,What are the key factors to consider when managing a patient with systemic lupus erythematosus (SLE) and nephritis?
q0395,name_like,What are the key steps in perioperative pain management for a patient undergoing major surgery?
q0398,name_like,What are the key indicators and interventions for a patient with speech impairment due to brain injury?
q0417,name_like,What evidence should be presented to a Clinical Ethics Committee when considering a patient's refusal of life-saving treatment due to religious beliefs?
q0418,name_like,What factors should a Clinical Ethics Committee consider when evaluating a request for organ donation from a terminally ill patient?
q0419,name_like,What ethical considerations should be taken into account when a Clinical Ethics Committee is deciding on the use of experimental treatments for terminal patients?
q0511,name_like,What are some common clinical signs and risk factors for lymphoma in dogs?
q0519,name_like,"What could be the possible causes of lethargy, anorexia, and vomiting in a 5-year-old Labrador Retriever?"
q0521,name_like,What are the treatment options for a 12-year-old Yorkshire Terrier with chronic kidney disease (CKD) and elevated blood pressure?
q0540,name_like,What could be the possible causes of recurrent corneal ulcers in a 5-year-old Miniature Schnauzer?
q0541,name_like,What diagnostic tests are essential for determining the cause of a 7-year-old Labrador Retriever's progressive blindness?
q0589,name_like,What are common diagnostic tests for identifying egg drop syndrome in broiler chickens?
q0620,name_like,"What are the risk factors for canine cutaneous lymphoma, and how can it be differentiated from other skin conditions?"
q0666,name_like,What could be the potential causes and symptoms of a sudden limp in a 7-year-old Labrador Retriever?
q0668,name_like,What are the potential complications and treatment options for a ruptured cruciate ligament in a 5-year-old German Shepherd?
q0710,name_like,What management strategies would a herd health consultant suggest for a flock of chickens with high mortality rates due to respiratory disease?
q0779,name_like,What are the key genetic disorders associated with developmental abnormalities in human embryology?
q0830,rationale_1_too_short,What are the recommended immunization schedules for adults aged 19-64 years to prevent vaccine-preventable diseases?
q0843,name_like,What historical events or figures have significantly impacted the development of medical ethics in the field of Medical Humanities?
q0844,name_like,What are some key ethical considerations when discussing end-of-life care decisions with patients suffering from terminal illnesses in Medical Humanities?
q0845,name_like,How has the history of medical ethics evolved in response to advancements in technology and biomedical research within Medical Humanities?
q0930,name_like,What are the common symptoms and laboratory findings in a patient with suspected Rheumatoid Arthritis?
q0931,name_like,What are the potential complications and management strategies for a severe flare-up of Rheumatoid Arthritis?
q0932,name_like,"What are the key differences between Rheumatoid Arthritis and Osteoarthritis in terms of symptoms, progression, and treatment?"
q0946,name_like,What are the key considerations when managing pain in hospice patients with advanced cancer?
q1088,name_like,What are the treatment options for a patient diagnosed with myelodysplastic syndrome (MDS) and what factors influence prognosis?
q1096,name_like,What are the key factors to consider when managing a patient with systemic lupus erythematosus (SLE) and nephritis?
q1179,name_like,What evidence should be presented to a Clinical Ethics Committee when considering a patient's refusal of life-saving treatment due to religious beliefs?
q1180,name_like,What factors should a Clinical Ethics Committee consider when evaluating a request for organ donation from a terminally ill patient?
q1181,name_like,What ethical considerations should be taken into account when a Clinical Ethics Committee is deciding on the use of experimental treatments for terminal patients?
q1222,name_like,What are the diagnostic imaging techniques and findings for space-induced osteoporosis in astronauts?
q1273,name_like,What are some common clinical signs and risk factors for lymphoma in dogs?
q1281,name_like,"What could be the possible causes of lethargy, anorexia, and vomiting in a 5-year-old Labrador Retriever?"
q1283,name_like,What are the treatment options for a 12-year-old Yorkshire Terrier with chronic kidney disease (CKD) and elevated blood pressure?
q1302,name_like,What could be the possible causes of recurrent corneal ulcers in a 5-year-old Miniature Schnauzer?
q1303,name_like,What diagnostic tests are essential for determining the cause of a 7-year-old Labrador Retriever's progressive blindness?
q1351,name_like,What are common diagnostic tests for identifying egg drop syndrome in broiler chickens?
q1382,name_like,"What are the risk factors for canine cutaneous lymphoma, and how can it be differentiated from other skin conditions?"
q1428,name_like,What could be the potential causes and symptoms of a sudden limp in a 7-year-old Labrador Retriever?
q1430,name_like,What are the potential complications and treatment options for a ruptured cruciate ligament in a 5-year-old German Shepherd?
q1472,name_like,What management strategies would a herd health consultant suggest for a flock of chickens with high mortality rates due to respiratory disease?
q1540,name_like,What are the potential genetic abnormalities associated with failure of gastrulation in human embryos?
q1605,name_like,What historical events or figures have significantly impacted the development of medical ethics in the field of Medical Humanities?
q1606,name_like,What are some key ethical considerations when discussing end-of-life care decisions with patients suffering from terminal illnesses in the context of Medical Humanities?
q1607,name_like,"How has the history of medical ethics evolved in response to technological advancements, such as genetic engineering and artificial intelligence, within the field of Medical Humanities?"
q1670,name_like,"What are the diagnostic criteria and treatment options for a patient with heart failure, peripheral edema, and shortness of breath?"
q1831,name_like,What are the potential treatment options for a 78-year-old female with New York Heart Association (NYHA) Class III heart failure and an ejection fraction of 20%?
q1938,name_like,What evidence should be presented to a Clinical Ethics Committee when considering a patient's refusal of life-saving treatment due to religious beliefs?
q1939,name_like,What factors should be considered when a Clinical Ethics Committee is evaluating a potential conflict of interest for a healthcare provider involved in a patient's care?
q1940,name_like,What ethical considerations should be taken into account when a Clinical Ethics Committee is discussing the use of experimental treatments in end-of-life care?
q1952,name_like,What are the common symptoms and diagnostic tests for a patient suspected of having West Nile virus infection?
q2043,name_like,What could be the potential causes of chronic limping in a 6-year-old Labrador Retriever?
q2061,name_like,What could be the possible causes of recurrent corneal ulcers in a 5-year-old Miniature Schnauzer?
q2062,name_like,What diagnostic tests are essential for determining the cause of a 7-year-old Labrador Retriever's progressive blindness?
q2231,name_like,What vaccination schedule would a herd health consultant recommend for a flock of laying hens to prevent common poultry diseases?
q2269,name_like,"What are some common zoonotic diseases transmitted from animals to humans in the context of One Health, and what are their symptoms?"
q2346,name_like,What are common statistical tests used in medical research for comparing two independent groups?
q2364,name_like,Discuss the historical significance of the discovery of the smallpox vaccine by Edward Jenner.
q2365,name_like,Analyze the role of medical ethics in the development and implementation of the Tuskegee Syphilis Study.
q2409,name_like,Describe common symptoms and diagnostic approaches for psoriasis in dermatology.
q2451,name_like,Describe common symptoms and diagnostic tests for Rheumatoid Arthritis.
q2452,name_like,Discuss the role of disease-modifying antirheumatic drugs (DMARDs) in managing Rheumatoid Arthritis.
q2453,name_like,Explain the link between Rheumatoid Arthritis and cardiovascular disease.
q2454,name_like,Describe common symptoms and diagnostic approaches for delirium in elderly patients.
q2575,name_like,What imaging techniques are used to diagnose HIV-related brain lesions?
q2616,name_like,Describe the diagnostic criteria for Rheumatoid Arthritis (RA) in adults.
q2617,name_like,What are the common management strategies for severe Rheumatoid Arthritis (RA) flare-ups?
q2618,name_like,Discuss the long-term complications associated with Rheumatoid Arthritis (RA) in patients.
q2622,name_like,Describe common symptoms and diagnostic approaches for delirium in elderly patients.
q2664,name_like,Describe the diagnostic criteria for type 2 diabetes mellitus.
q2774,name_like,Discuss risk factors for canine hip dysplasia and their impact on breed selection.
q2787,name_like,Describe common genetic disorders in dogs and their symptoms.
q2794,name_like,Discuss the ethical considerations involved in using laboratory animals for research.
q2831,name_like,Discuss risk factors for the development of feline idiopathic cystitis.
q2865,name_like,Describe common clinical signs and diagnostic tests for bovine displaced abomasum.
q2887,name_like,What are the risk factors and differential diagnoses for enteritis in camelids?
q2903,name_like,Discuss the risk factors and diagnostic considerations for canine cutaneous lymphoma.
q2950,name_like,What are potential causes of canine hip dysplasia?
q2963,name_like,Suggest management strategies for treating swine with post-weaning multisystemic wasting syndrome (PMWS).
q3030,name_like,Discuss the role of One Health in managing zoonotic diseases like Lyme disease.
q3031,name_like,Explain how climate change affects the prevalence of zoonotic diseases like West Nile virus.
q3032,name_like,Describe the significance of One Health approach in managing antimicrobial resistance in livestock.
q3045,name_like,Describe the clinical signs and diagnostic methods for Chronic Wasting Disease in cervids.
q3047,name_like,What are the treatment options for West Nile Virus infections in wild birds?
q3082,name_like,Discuss the laboratory diagnostic methods used to identify Staphylococcus aureus in clinical samples.
q3108,name_like,What are common statistical tests used in medical research for comparing two independent groups?
q3109,name_like,What are the key differences between parametric and non-parametric statistical tests?
q3110,name_like,What are some common statistical tests used in medical research for analyzing repeated measures within a single group?
q3126,name_like,Discuss the historical significance of the discovery of the smallpox vaccine by Edward Jenner.
q3127,name_like,Describe the role of Hippocrates in the development of modern medicine.
q3128,name_like,Analyze the impact of the Black Death on European society during the Middle Ages.
q3134,name_like,Discuss the impact of physiotherapy on pain management for patients with osteoarthritis.
q3144,name_like,Describe the diagnostic criteria for type 2 diabetes mellitus.
q3147,name_like,What are common symptoms and risk factors for type 2 diabetes in a family medicine setting?
q3171,name_like,Describe common symptoms and diagnostic approaches for psoriasis in dermatology.
q3200,name_like,Explain the role of glomerular filtration rate (GFR) in diagnosing and monitoring kidney disease.
q3213,name_like,Describe common symptoms and diagnostic tests for Rheumatoid Arthritis.
q3214,name_like,What are the treatment options for severe Rheumatoid Arthritis?
q3215,name_like,Explain the link between Rheumatoid Arthritis and cardiovascular disease.
q3216,name_like,Describe common symptoms and diagnostic approaches for delirium in elderly patients.
q3301,name_like,What are the surgical techniques used to treat glaucoma in advanced stages?
q3349,name_like,What are the common risk factors for developing type 2 diabetes in adults?
q3352,name_like,What are the management strategies for a patient with chronic heart failure in New York Heart Association (NYHA) Class III or IV?
q3378,name_like,Describe common symptoms and diagnostic tests for Rheumatoid Arthritis.
q3379,name_like,Explain the role of disease-modifying antirheumatic drugs (DMARDs) in managing Rheumatoid Arthritis.
q3380,name_like,Discuss the link between Rheumatoid Arthritis and cardiovascular disease.
q3497,name_like,Describe the application of Tai Chi for improving balance and reducing falls in older adults with Parkinson's disease.
q3549,name_like,Describe common genetic disorders in dogs and their symptoms.
q3550,name_like,Discuss the role of genetics in inherited diseases in cats.
q3554,name_like,Describe the diagnostic process for identifying West Nile virus in wild birds.
q3557,name_like,Discuss the ethical considerations involved in using lab animals in research.
q3627,name_like,Describe common clinical signs and diagnostic tests for bovine displaced abomasum.
q3792,name_like,Discuss the role of One Health in managing zoonotic diseases like Lyme disease.
q3793,name_like,Explain how climate change affects the prevalence of zoonotic diseases like West Nile virus.
q3794,name_like,Discuss the implications of antimicrobial resistance on One Health and potential solutions.
q3807,name_like,Describe the clinical signs and diagnostic methods for Chronic Wasting Disease in cervids.
q3820,name_like,What are the common congenital anomalies associated with developmental abnormalities in the human brain?
q3907,name_like,What are common statistical tests used in medical research for comparing two independent groups?
q3908,bad_rationales_count,What is the significance of a p-value less than 0.05 in medical research?
q3910,bad_rationales_count,What are some common assumptions made when using parametric statistical tests in medical research?
q3936,name_like,Discuss the historical significance of the Hippocratic Oath in modern medical ethics.
q3938,name_like,Describe the contributions of William Osler to the field of medicine.
q4076,name_like,What are the prognostic factors for a patient with metastatic renal cell carcinoma (mRCC) undergoing immunotherapy treatment?
q4078,name_like,Describe common symptoms and diagnostic criteria for Rheumatoid Arthritis.
q4079,name_like,What are potential complications and management strategies for severe Rheumatoid Arthritis?
q4080,name_like,What are common causes and risk factors associated with Rheumatoid Arthritis?
q4081,name_like,What are the differences between Rheumatoid Arthritis and Osteoarthritis?
q4082,name_like,Describe common symptoms and diagnostic approaches for delirium in elderly patients.
q4084,name_like,Describe the impact of malnutrition on elderly patients' health and potential interventions.
q4103,name_like,What are the key principles of pain management in hospice care for patients with advanced cancer?
q4128,name_like,What are effective treatment options for opioid addiction?
q4203,name_like,What are the contraindications for laparoscopic surgery in elderly patients?
q4280,name_like,What are common viral pathogens detected in a virology lab for respiratory infections?
q4284,name_like,What are the diagnostic tests and imaging techniques used to diagnose viral encephalitis?
q4349,name_like,Describe the diagnostic criteria for Rheumatoid Arthritis (RA) in adults.
q4350,name_like,What are the common treatments for severe Rheumatoid Arthritis (RA) flare-ups?
q4351,name_like,What are the risk factors for developing Rheumatoid Arthritis (RA) in young adults?
q4352,name_like,What are the long-term complications associated with Rheumatoid Arthritis (RA)?
q4353,name_like,What are the differences between Rheumatoid Arthritis (RA) and Osteoarthritis (OA)?
q4360,name_like,Describe the diagnostic approach for delirium in elderly patients.
q4429,name_like,Describe the diagnostic criteria for type 2 diabetes mellitus.
q4486,name_like,"Describe the process of hospital accreditation and its impact on patient care, quality, and safety."
q4607,name_like,Discuss the risk factors associated with canine lymphoma.
q4629,name_like,Describe common genetic disorders in dogs and their symptoms.
q4632,name_like,Discuss the impact of selective breeding on the health and welfare of dogs.
q4682,name_like,What are the risk factors associated with canine idiopathic epilepsy?
q4761,name_like,Explain the causes and risk factors of laminitis in horses.
q4815,name_like,What are the risk factors for canine lymphoma?
q4898,name_like,What are common surgical procedures for canine cruciate ligament rupture?
q4963,name_like,What diagnostic tests can be used to evaluate a dog's cognitive dysfunction syndrome (CDS)?
q5007,name_like,What are the risk factors for developing osteosarcoma in dogs?
q5016,name_like,What are common telemedicine platforms used by veterinarians for remote consultations?
q5029,name_like,Discuss the role of One Health in managing zoonotic diseases like Lyme disease.
q5031,name_like,Describe the importance of One Health approach in addressing antimicrobial resistance.
q5032,name_like,Explain how One Health can help in diagnosing and treating foodborne illnesses.
q5054,name_like,Describe the clinical signs and diagnostic methods for Chronic Wasting Disease in cervids.
q5057,name_like,What are the diagnostic challenges in identifying West Nile virus infection in wild birds?
q5078,name_like,Describe the role of Fibroblast Growth Factors (FGFs) in embryonic development.
q5124,name_like,"Explain the function of T cells in adaptive immunity, focusing on their role in cell-mediated immunity."
q5187,name_like,Discuss the historical significance of the discovery of the smallpox vaccine by Edward Jenner.
q5188,name_like,Describe the role of Hippocrates in the development of Western medicine and his contributions to medical ethics.
q5189,name_like,"Analyze the impact of the Black Death on European society, focusing on economic, social, and cultural changes."
q5190,name_like,Explain the role of Galen in the development of ancient Greek medicine and his influence on later medical thought.
q5191,name_like,"Discuss the impact of the Flexner Report on medical education in the United States, focusing on its effects on curriculum, faculty, and facilities."
q5219,name_like,What are common symptoms and risk factors for type 2 diabetes in a middle-aged adult?
q5253,name_like,Describe common symptoms and diagnostic approaches for Attention Deficit Hyperactivity Disorder (ADHD) in children.
q5273,name_like,Describe common symptoms and diagnostic tests for glaucoma in adults.
q5306,name_like,Describe the diagnostic approach for Type 1 Diabetes Mellitus in children.
q5325,name_like,Describe common symptoms and diagnostic tests for Rheumatoid Arthritis.
q5326,name_like,What are the treatment options for severe Rheumatoid Arthritis?
q5327,name_like,What are the risk factors associated with developing Rheumatoid Arthritis?
q5328,name_like,What are the differences between Rheumatoid Arthritis and Osteoarthritis?
q5329,name_like,What are the long-term complications of untreated Rheumatoid Arthritis?
q5351,name_like,What are the key considerations when managing pain in hospice patients with advanced cancer?
q5355,name_like,Describe the diagnostic process for chronic regional pain syndrome (CRPS) in adults.
q5370,name_like,What are common symptoms and diagnostic tests for mononucleosis in adolescents?
q5592,name_like,What are the diagnostic criteria for multiple myeloma?
q5600,name_like,Describe the diagnostic criteria for Rheumatoid Arthritis (RA) in adults.
q5601,name_like,What are the common treatment options for severe Rheumatoid Arthritis (RA) flare-ups?
q5602,name_like,What are the risk factors associated with developing Rheumatoid Arthritis (RA) in women?
q5603,name_like,What are the potential complications of long-term Rheumatoid Arthritis (RA) management with corticosteroids?
q5604,name_like,"What are the differences between Rheumatoid Arthritis (RA) and Osteoarthritis (OA) in terms of symptoms, progression, and treatment?"
q5647,name_like,What are the diagnostic criteria for hepatocellular carcinoma (HCC) according to the American Association for the Study of Liver Diseases (AASLD)?
q5655,name_like,Describe the common symptoms and diagnostic criteria for obstructive sleep apnea in adults.
q5669,name_like,Discuss the use of angiotensin-converting enzyme (ACE) inhibitors in heart failure with reduced ejection fraction.
q5700,name_like,Describe the common symptoms and diagnostic tests for sepsis in a critical care setting.
q5737,name_like,Describe the key performance indicators (KPIs) used by hospital administrators to measure the efficiency and quality of care.
q5796,name_like,Discuss the role of Tai Chi in improving cardiovascular health.
q5800,name_like,Explain the use of botulinum toxin (Botox) for treating excessive sweating (hyperhidrosis).
q5822,name_like,"What are the common breed-specific health issues found in Labrador Retrievers, and how can they be managed?"
q5855,name_like,Discuss the risk factors for canine leishmaniasis and its geographical distribution.
q5880,name_like,What laboratory tests are useful in diagnosing canine hypothyroidism?
q5884,name_like,Describe common genetic disorders in dogs and their symptoms.
q5885,name_like,What are the diagnostic tests used to identify genetic disorders in dogs?
q5888,name_like,What are some common genetic disorders in cats and their symptoms?
q5907,name_like,What are the risk factors for canine hip dysplasia?
q5932,name_like,What are risk factors for heartworm disease in dogs?
q5937,name_like,What are the risk factors for canine degenerative myelopathy (DM) and how is it diagnosed?
q5942,name_like,What are common risk factors for canine cutaneous lymphoma?
q6055,name_like,What diagnostic tests are used to confirm canine hip dysplasia?
q6111,name_like,What are potential risk factors for cancer development in dogs?
q6117,name_like,What are the risk factors for diabetes mellitus in cats?
q6155,name_like,What are potential complications and risk factors for feline diabetes mellitus?
q6289,name_like,Discuss the role of One Health in managing zoonotic diseases like Lyme disease.
q6290,name_like,Describe the impact of climate change on the prevalence of zoonotic diseases like West Nile virus.
q6292,name_like,Discuss the role of One Health in addressing food safety issues related to animal products.
q6293,name_like,Describe the significance of wildlife conservation efforts in maintaining One Health.
q6317,name_like,"Discuss the epidemiology, transmission routes, and control measures for African Swine Fever in wild boars."
q6318,name_like,Describe the diagnostic challenges and differential diagnoses for West Nile Virus in birds.
q6324,bad_rationales_count,Describe the role of histology in diagnosing liver diseases.
q6325,bad_rationales_count,What are the common causes and symptoms of pancreatitis in dogs?
q6326,bad_rationales_count,Explain the pathophysiology of sepsis in humans.
q6327,bad_rationales_count,What are the diagnostic imaging techniques used for identifying kidney stones in cats?
q6328,bad_rationales_count,Describe the role of genetics in the development of breast cancer.
q6329,bad_rationales_count,What are the common causes and symptoms of diabetes mellitus in horses?
q6330,bad_rationales_count,Explain the pathophysiology of multiple sclerosis in humans.
q6331,bad_rationales_count,What are the diagnostic tests used for identifying Lyme disease in dogs?
q6332,bad_rationales_count,Describe the role of nutrition in managing chronic kidney disease in cats.
q6333,bad_rationales_count,What are the common causes and symptoms of hypothyroidism in rabbits?
q6334,bad_rationales_count,Explain the pathophysiology of Parkinson's disease in humans.
q6335,bad_rationales_count,What are the diagnostic tests used for identifying feline leukemia virus (FeLV) in cats?
q6336,bad_rationales_count,Describe the role of genetics in the development of Alzheimer's disease.
q6340,name_like,What are the diagnostic imaging techniques used for brain tumors in humans?
q6343,name_like,What are the treatment options for Parkinson's disease in humans?
q6366,bad_rationales_count,"Describe the developmental stages of avian embryos, focusing on the formation of feathers."
